{
  "$schema": "./schema/component.schema.json",
  "name": "RippleButton",
  "version": "0.1.0",
  "category": "motion",
  "status": "experimental",
  "description": "A button that sends a ripple out from where you pressed it, or from its centre when pressed with the keyboard. Builds on Button.",
  "props": {
    "children": {
      "type": "node",
      "description": "Button label. Icon-only buttons must pass aria-label instead.",
      "required": true
    },
    "variant": {
      "type": "enum",
      "values": [
        "primary",
        "secondary",
        "ghost",
        "danger"
      ],
      "description": "Visual emphasis, as on Button.",
      "default": "primary"
    },
    "size": {
      "type": "enum",
      "values": [
        "sm",
        "md",
        "lg"
      ],
      "description": "Height, padding and font size, as on Button.",
      "default": "md"
    },
    "duration": {
      "type": "number",
      "description": "Milliseconds the ripple takes to spread and fade.",
      "default": 600
    },
    "isDisabled": {
      "type": "boolean",
      "description": "Prevents interaction and dims the button.",
      "default": false
    },
    "isLoading": {
      "type": "boolean",
      "description": "Shows a spinner and blocks presses; the pending state is announced.",
      "default": false
    },
    "onPress": {
      "type": "callback",
      "tsType": "() => void",
      "description": "Called when the button is pressed by mouse, touch or keyboard."
    }
  },
  "variants": [
    "variant",
    "size"
  ],
  "states": [
    "default"
  ],
  "slots": [
    "root",
    "label",
    "ripple"
  ],
  "tokens": [
    "color.action.primary",
    "color.action.on-primary",
    "color.action.danger",
    "color.surface.default",
    "color.text.default",
    "color.border.default",
    "color.focus.ring",
    "radius.control"
  ],
  "a11y": {
    "role": "button",
    "keyboard": [
      "Tab focuses it",
      "Enter or Space presses it"
    ],
    "requirements": [
      "Decoration only: the animated layers are hidden from assistive technology and never take focus",
      "Stands still for visitors who ask for less motion (prefers-reduced-motion), and the effect can also be shown still with the rdm-still class",
      "Each ripple is removed when it finishes, so a button pressed many times does not grow",
      "Does not flash: nothing changes more than three times in a second (WCAG 2.3.1)",
      "Optional: it is a separate component, so projects that do not add it carry none of its code"
    ],
    "screenReader": [
      "Announced exactly as a Button: its label, as a button; the effect adds nothing to what is read"
    ],
    "wcag": "2.2 AA"
  },
  "usage": {
    "use_when": [
      "Touch-first interfaces that want visible press feedback",
      "Playful or media apps"
    ],
    "avoid_when": [
      "Buttons that are pressed many times a second",
      "When a plain pressed state is enough"
    ],
    "anti_patterns": [
      "A duration over about a second",
      "Stacking it with other effects on the same button"
    ]
  },
  "examples": [
    "basic",
    "variants"
  ],
  "figma": {
    "componentKey": null,
    "variantMap": {
      "variant": "Variant",
      "size": "Size"
    }
  }
}
