{
  "$schema": "./schema/component.schema.json",
  "name": "Toast",
  "version": "0.1.0",
  "category": "feedback",
  "status": "experimental",
  "description": "Brief, non-blocking message about the result of an action. Render ToastRegion once and call toast().",
  "props": {
    "title": {
      "type": "string",
      "required": true,
      "description": "Main message."
    },
    "description": {
      "type": "string",
      "description": "Optional extra detail."
    },
    "variant": {
      "type": "enum",
      "values": [
        "neutral",
        "success",
        "danger"
      ],
      "default": "neutral",
      "description": "Tone of the message."
    },
    "timeout": {
      "type": "number",
      "default": 10000,
      "description": "Auto-dismiss after this many ms (10 seconds by default). 0 keeps it open until the person closes it. Timers pause while the pointer is over the toast or it has keyboard focus, so nobody loses a message they are reading."
    },
    "animated": {
      "type": "boolean",
      "default": false,
      "description": "Opt in to a fuller slide: the toast glides in from the edge and slides back out when dismissed. Off by default, which keeps the existing small rise and fade. Visitors who ask for less motion get no movement either way."
    }
  },
  "variants": [
    "variant"
  ],
  "states": [
    "default",
    "focus"
  ],
  "slots": [
    "region",
    "toast",
    "title",
    "description",
    "close"
  ],
  "tokens": [
    "color.surface.raised",
    "color.border.default",
    "color.text.default",
    "color.text.muted",
    "color.feedback.success",
    "color.feedback.danger",
    "color.focus.ring",
    "radius.overlay"
  ],
  "a11y": {
    "role": "alertdialog",
    "keyboard": [
      "F6 moves focus to the toast region",
      "Tab reaches the close button",
      "Esc dismisses the focused toast"
    ],
    "requirements": [
      "New toasts are announced by screen readers",
      "Auto-dismiss pauses on hover and focus",
      "Messages with actions should not auto-dismiss",
      "The optional animated slide is skipped for visitors who prefer reduced motion, and never delays the message"
    ],
    "screenReader": [
      "A new toast is announced without moving focus",
      "F6 moves into the notifications region; the toast's title and description are read",
      "The dismiss button is announced as Dismiss",
      "A focused toast does not disappear while you read it"
    ],
    "wcag": "2.2 AA"
  },
  "usage": {
    "use_when": [
      "Confirming a completed action, like 'Saved'",
      "Reporting a background failure"
    ],
    "avoid_when": [
      "Errors the user must fix in a form: show them inline",
      "Critical decisions: use Dialog"
    ],
    "anti_patterns": [
      "Several toasts at once for one action",
      "Important info that disappears too fast"
    ]
  },
  "examples": [
    "success",
    "danger",
    "persistent",
    "animated"
  ],
  "figma": {
    "componentKey": null,
    "variantMap": {
      "variant": "Variant"
    }
  }
}
