{
  "$schema": "./schema/component.schema.json",
  "name": "RevealButton",
  "version": "0.1.0",
  "category": "motion",
  "status": "experimental",
  "description": "A button that opens an arrow beside its label when you hover or focus it, to suggest \"go\". Only a transition, so there is nothing to pause. Builds on Button.",
  "props": {
    "children": {
      "type": "node",
      "description": "Button label. Icon-only buttons must pass aria-label instead.",
      "required": true
    },
    "variant": {
      "type": "enum",
      "values": [
        "primary",
        "secondary",
        "ghost",
        "danger"
      ],
      "description": "Visual emphasis, as on Button.",
      "default": "primary"
    },
    "size": {
      "type": "enum",
      "values": [
        "sm",
        "md",
        "lg"
      ],
      "description": "Height, padding and font size, as on Button.",
      "default": "md"
    },
    "isDisabled": {
      "type": "boolean",
      "description": "Prevents interaction and dims the button.",
      "default": false
    },
    "isLoading": {
      "type": "boolean",
      "description": "Shows a spinner and blocks presses; the pending state is announced.",
      "default": false
    },
    "onPress": {
      "type": "callback",
      "tsType": "() => void",
      "description": "Called when the button is pressed by mouse, touch or keyboard."
    }
  },
  "variants": [
    "variant",
    "size"
  ],
  "states": [
    "default"
  ],
  "slots": [
    "root",
    "label",
    "arrow"
  ],
  "tokens": [
    "color.action.primary",
    "color.action.on-primary",
    "color.action.danger",
    "color.surface.default",
    "color.text.default",
    "color.border.default",
    "color.focus.ring",
    "radius.control"
  ],
  "a11y": {
    "role": "button",
    "keyboard": [
      "Tab focuses it",
      "Enter or Space presses it"
    ],
    "requirements": [
      "Decoration only: the animated layers are hidden from assistive technology and never take focus",
      "Stands still for visitors who ask for less motion (prefers-reduced-motion), and the effect can also be shown still with the rdm-still class",
      "The arrow appears on keyboard focus as well as hover, and is decorative",
      "The transition is switched off for reduced motion, leaving the arrow in its final state only on hover or focus",
      "Does not flash: nothing changes more than three times in a second (WCAG 2.3.1)",
      "Optional: it is a separate component, so projects that do not add it carry none of its code"
    ],
    "screenReader": [
      "Announced exactly as a Button: its label, as a button; the effect adds nothing to what is read"
    ],
    "wcag": "2.2 AA"
  },
  "usage": {
    "use_when": [
      "Buttons that lead somewhere: Read more, Continue, View all"
    ],
    "avoid_when": [
      "Destructive actions"
    ],
    "anti_patterns": [
      "Relying on the arrow alone to say where it goes"
    ]
  },
  "examples": [
    "basic",
    "variants"
  ],
  "figma": {
    "componentKey": null,
    "variantMap": {
      "variant": "Variant",
      "size": "Size"
    }
  }
}
